{
  "type": "assessment.completed",
  "organisationId": "8f0c2d44-6a1e-4b7a-9c3d-1e5f7a9b0c21",
  "personId": "7d2b6f18-9c40-4e15-8a73-5b1d0e6f4a22",
  "sessionId": "session-1",
  "planId": "plan-1",
  "actorPersonId": "7d2b6f18-9c40-4e15-8a73-5b1d0e6f4a22",
  "profileVersionId": "version-1",
  "occurredAt": "2026-10-23T12:00:00Z"
}
